{
  "job_id": "docs-plugins-netsuite-troubleshooting",
  "attempt": 1,
  "source_page": "---\ntitle: \"NetSuite payments bundle troubleshooting\"\ntype: source\ndate_ingested: 2026-10-16\noriginal_format: webpage\ncanonical_url: \"https://docs.adyen.com/plugins/netsuite/troubleshooting\"\nraw_files:\n  - \"adyen/docs/plugins/netsuite/troubleshooting/2026-09-15.md\"\ntags: [adyen, netsuite, troubleshooting, support]\n---\n\n## Overview\n\nAdyen's NetSuite payments-bundle troubleshooting page (metadata last modified 2023-10-02; captured 2026-09-15) provides a short triage route: verify bundle setup, isolate customizations, check release notes, then contact Support with reproducible evidence if unresolved. It does not diagnose a particular authorization or configuration failure, prescribe a payment retry, or prove that a fix or payment succeeded. See [[adyen-netsuite]] for the integration scope.\n\n## Key takeaways\n\n- First check that the NetSuite payments bundle was set up correctly; the page links to the separate Customer Center setup guide for those instructions (raw lines 19\u201323).\n- If the bundle was customized, check whether the problem reproduces on a clean installation before attributing it to the Adyen bundle. The page says a problem absent from the clean version is most likely introduced by the customization, which is a diagnostic likelihood rather than a verified root cause (raw lines 25\u201327).\n- Check release notes for a known issue and a fix in a later bundle version; the page names no affected or fixed version and does not establish that upgrading will resolve a particular incident (raw lines 29\u201331).\n- If unresolved, provide Support the merchant account, test/live environment (**Sandbox/Production** in NetSuite), reproduction steps and attempted fixes, screenshots/error details, initial request/response and plugin-related logs, NetSuite payment-processing settings, applicable successful/failed test example, and any earlier NetSuite support information (raw lines 33\u201344). The page does not specify an authorization error code, security remediation, safe retry rule, or financial outcome.\n\n## Detail locators\n\n- Bundle setup and customization isolation: raw lines 19\u201327.\n- Known-issue/release-note check: raw lines 29\u201331.\n- Support escalation evidence, including environment and logs: raw lines 33\u201344.\n\n## Related\n\n- [[adyen-netsuite]] \u2014 NetSuite payments-bundle concept and source route.\n- [[source-adyen-docs-plugins-netsuite-set-up-netsuite-customer-center]] \u2014 linked setup guide; configuration details belong to that source.\n- [[adyen]] \u2014 Adyen provider page.\n\n## Raw Sources\n\n- [[raw/adyen/docs/plugins/netsuite/troubleshooting/2026-09-15|NetSuite troubleshooting, captured 2026-09-15]]\n",
  "quotes": [
    {
      "text": "Make sure that you [set up the bundle correctly](/plugins/netsuite/set-up-netsuite-customer-center).",
      "location": "raw/adyen/docs/plugins/netsuite/troubleshooting/2026-09-15.md line 23"
    },
    {
      "text": "If you cannot reproduce the issue with a clean version, it is most likely an issue introduced by the customization.",
      "location": "raw/adyen/docs/plugins/netsuite/troubleshooting/2026-09-15.md line 27"
    },
    {
      "text": "Check if your current error is a known issue in the bundle, and resolved in a later version.",
      "location": "raw/adyen/docs/plugins/netsuite/troubleshooting/2026-09-15.md line 31"
    },
    {
      "text": "Whether the issue occurs in the test or live environment (Sandbox and Production in NetSuite).",
      "location": "raw/adyen/docs/plugins/netsuite/troubleshooting/2026-09-15.md line 38"
    },
    {
      "text": "Logs: initial request, response, and any other plugin-related logs.",
      "location": "raw/adyen/docs/plugins/netsuite/troubleshooting/2026-09-15.md line 41"
    }
  ],
  "suggestions": {
    "company": [],
    "concepts": [
      {
        "update_id": "docs-plugins-netsuite-troubleshooting-netsuite-route",
        "target_path": "wiki/concepts/adyen-netsuite.md",
        "update_kind": "reciprocal_source_link",
        "anchor": "## Sources",
        "proposed_markdown": "- [[source-adyen-docs-plugins-netsuite-troubleshooting]] \u2014 2023-modified, 2026-09-15-captured NetSuite payments-bundle triage checklist for setup, customization isolation, release notes and Support evidence; no incident diagnosis or proven remedy.\n",
        "quote_indexes": [
          0,
          1,
          2,
          3,
          4
        ],
        "warnings": [
          "The page has no exact version, authorization error-code table, payment-retry rule or security remediation; do not infer these from its setup/release/support links."
        ]
      }
    ],
    "index": [],
    "log": []
  },
  "raw_path": "raw/adyen/docs/plugins/netsuite/troubleshooting/2026-09-15.md",
  "raw_sha256": "f6700e0f44098bbc867f71c39e8b765fff3757d3dd1978b5126bf78a1f3ff8d5",
  "status": "candidate_ready"
}
