{
  "job_id": "docs-issuing-kyc-verification-codes",
  "attempt": 1,
  "source_page": "---\ntitle: \"Adyen Issuing: Verification code structure and retrieval\"\ntype: source\ndate_ingested: 2026-10-19\noriginal_format: webpage\ncanonical_url: \"https://docs.adyen.com/issuing/kyc-verification-codes\"\nraw_files:\n  - \"adyen/docs/issuing/kyc-verification-codes/2026-09-15.md\"\ntags: [adyen, issuing, kyc, verification, error-codes]\n---\n\n## Overview\n\nThis Adyen Issuing/Platforms guide (last modified 2024-06-04; captured 2026-09-15) explains where verification codes appear and how general error codes, granular suberrors and suggested remediating-action codes relate. Codes convey failed-check causes and possible user actions; a remediating action is sent whenever possible, not guaranteed for every error. This is an error-handling and navigation guide, not a full code catalogue or proof that a capability is allowed. [[adyen]] [[adyen-issuing]]\n\n## Key takeaways\n\n- The guide applies to an Adyen for Platforms or Adyen Issuing integration. API viewing requires a Configuration API web-service user credential; Customer Area viewing requires the **Manage account holder capabilities** role (raw lines 27-35).\n- In Customer Area, find the account holder and inspect its **Capabilities** tab for enabled, allowed and verification status. Through API/webhooks, GET `/accountHolders/{id}` or follow `balancePlatform.accountHolder.created` and `.updated`; verification codes appear in a capability's `problems` array (raw lines 37-61).\n- A `problems` entry identifies the affected legal entity and has `verificationErrors`; an error can contain `type` (`invalidInput` or `dataMissing`), general `code` and `message`, optional common `remediatingActions`, and `subErrors` with their own type/code/message/actions (raw lines 69-81). The sample shows an invalid verification status with one general `1_30` error and granular `1_3001`/`1_3000` suberrors; the `...` markers mean it is illustrative, not parse-ready JSON (raw lines 83-144).\n- For API-only onboarding, Adyen recommends choosing error-handling flows appropriate to the use case and development resources while building the implementation to handle all possible verification codes (raw lines 63-67). Use suberror codes to construct specific flows or to test scenarios; do not assume every error has one definitive action (raw lines 19-25).\n\n## Detail locators\n\n- Separate code lists: [[source-adyen-docs-issuing-kyc-verification-codes-general-verification-errors]] for broad causes, [[source-adyen-docs-issuing-kyc-verification-codes-sub-errors]] for specific causes, and [[source-adyen-docs-issuing-kyc-verification-codes-remediating-actions]] for possible solutions. These are linked in the guide's Next steps at raw lines 146-164.\n- Test failure and remediation flow: [[source-adyen-docs-issuing-test-verification-errors]], linked at raw lines 25 and 150-152. The present page alone does not authorize a live verification result.\n\n## Related\n\n- [[adyen]] \u2014 provider.\n- [[adyen-issuing]] \u2014 Issuing concept.\n- [[source-adyen-docs-issuing-kyc-verification-codes-general-verification-errors]] \u2014 general code list.\n- [[source-adyen-docs-issuing-kyc-verification-codes-sub-errors]] \u2014 granular code list.\n- [[source-adyen-docs-issuing-kyc-verification-codes-remediating-actions]] \u2014 action code list.\n- [[source-adyen-docs-issuing-test-verification-errors]] \u2014 test-only scenario flow.\n\n## Raw Sources\n\n- [[raw/adyen/docs/issuing/kyc-verification-codes/2026-09-15|2026-09-15 capture of Adyen verification codes guide]]\n",
  "quotes": [
    {
      "text": "**Remediating action codes**: Provides possible solutions to fix a verification error. Whenever possible, Adyen sends a remediating action for every error.",
      "location": "raw/adyen/docs/issuing/kyc-verification-codes/2026-09-15.md:21"
    },
    {
      "text": "**Specific suberror codes**: Provides a more granular and specific cause of the verification error. Suberrors are linked to the general error codes.",
      "location": "raw/adyen/docs/issuing/kyc-verification-codes/2026-09-15.md:23"
    },
    {
      "text": "The verification codes are in the [`problems` array](#example-problems-array).",
      "location": "raw/adyen/docs/issuing/kyc-verification-codes/2026-09-15.md:61"
    },
    {
      "text": "We try to provide you with the most accurate feedback. This requires you to build your implementation so that it can handle all possible verification codes. Using all the codes allows you to resolve issues for your users by providing them with more information about errors and what they need to do next.",
      "location": "raw/adyen/docs/issuing/kyc-verification-codes/2026-09-15.md:67"
    },
    {
      "text": "When a verification error occurs, you get information from the [problems](https://docs.adyen.com/api-explorer/balanceplatform/latest/get/accountHolders/\\(id\\)#responses-200-capabilities-problems) array in an API response or a webhook. This array contains the following.",
      "location": "raw/adyen/docs/issuing/kyc-verification-codes/2026-09-15.md:71"
    }
  ],
  "suggestions": {
    "company": [],
    "concepts": [
      {
        "update_id": "c21-issuing-kyc-verification-codes-link",
        "target_path": "wiki/concepts/adyen-issuing.md",
        "update_kind": "reciprocal_source_link",
        "anchor": "## Sources",
        "proposed_markdown": "- [[source-adyen-docs-issuing-kyc-verification-codes]] \u2014 2024-modified, 2026-09-15-captured overview of Issuing/Platforms verification code structure, account-holder capability `problems` retrieval and separate general/suberror/remediating-action catalogues.\n",
        "quote_indexes": [
          0,
          1,
          2,
          3,
          4
        ],
        "warnings": []
      }
    ],
    "index": [],
    "log": []
  },
  "raw_path": "raw/adyen/docs/issuing/kyc-verification-codes/2026-09-15.md",
  "raw_sha256": "d0e1f5e5341d854c65d0b65cb17fe15efd81b5bbb5f0766832df520a2388bd91",
  "status": "candidate_ready"
}
