{
  "job_id": "docs-platforms-reconciliation-use-cases-first-year-focus",
  "attempt": 1,
  "source_page": "---\ntitle: \"First year operational tasks | Adyen for Platforms\"\ntype: source\ndate_ingested: 2026-10-18\noriginal_format: webpage\ncanonical_url: \"https://docs.adyen.com/platforms/reconciliation-use-cases/first-year-focus\"\nraw_files:\n  - \"adyen/docs/platforms/reconciliation-use-cases/first-year-focus/2026-09-15.md\"\ntags: [adyen, platforms, reporting, reconciliation, operations]\n---\n\n## Overview\n\nThis 2026-09-15 [[adyen]] for Platforms page frames reporting and reconciliation use cases to prioritize during the first year of an embedded-payments offering. It separates platform product/finance stakeholders from SMB platform users, argues for early finance/product/engineering alignment, and routes to separate platform-level and user-level reporting guides. See [[adyen-reporting]] for the main reporting route. This is a planning guide, not a report schema, accounting opinion or evidence that any records have reconciled.\n\n## Key takeaways\n\n- The page distinguishes reporting (financial statements and activity summaries) from reconciliation (comparing record sets for discrepancies) and says reports support reconciliation. Its bank-reconciliation example describes comparison with bank records; the page itself does not supply a bank statement or proof of matched balances. [Raw: lines 19\u201327]\n- At platform level, the product team builds industry-specific reporting features and may own embedded-payments P&L/pricing strategy; the finance team handles budgeting, accounting, reporting, reconciliation of revenue/fees against Adyen reports and invoices, cash-flow/payment-data monitoring, periodic settlement-versus-internal-record checks, statements and audits. These are stakeholder tasks, not a claim that one Adyen report contains every required grain. [Raw: lines 29\u201347]\n- For SMB platform users, the page identifies daily review of financial reports and metrics plus discrepancy resolution, and periodic finance reconciliation, tax filing, statement review and comparison of bank statements with internal payment/fee records, sometimes with an external accountant. These are illustrative user needs, not instructions that the platform already supplies each report or completes its users' accounting. [Raw: lines 49\u201364]\n- Because pricing models, funds flows, currencies and transaction statuses complicate reporting, the guide recommends involving finance early in requirements gathering, with product and engineering according to implementation/granularity. Its next-step links lead to separate platform-level and user-level reporting processes; those child pages own actual report choices, row grains, joins and limitations. The captured `[required]` link labels are navigation artifacts, not standalone eligibility or compliance requirements. [Raw: lines 66\u201388]\n\n## Detail locators\n\n- Purpose and reporting-versus-reconciliation distinction: raw lines 17\u201327.\n- Platform product/finance stakeholder tasks: raw lines 29\u201347.\n- SMB user daily and periodic reporting tasks: raw lines 49\u201364.\n- Early cross-functional requirements and platform/user child routes: raw lines 66\u201388.\n\n## Related\n\n- [[adyen-reporting]] \u2014 provider reporting and reconciliation evidence boundary\n- [Platform-level reporting](https://docs.adyen.com/platforms/reconciliation-use-cases/first-year-focus/platform-level-reporting) \u2014 linked detailed platform use cases\n- [User-level reporting](https://docs.adyen.com/platforms/reconciliation-use-cases/first-year-focus/platform-user-level-reporting) \u2014 linked detailed user use cases\n- [Reconciliation use cases](https://docs.adyen.com/platforms/reconciliation-use-cases) \u2014 parent navigation\n\n## Raw Sources\n\n- [[raw/adyen/docs/platforms/reconciliation-use-cases/first-year-focus/2026-09-15|Adyen Platforms first year operational tasks \u2014 collected 2026-09-15]]\n",
  "quotes": [
    {
      "text": "An overview of the key reporting use cases for reconciliation to prioritize in your first year of operation.",
      "location": "raw line 17, introduction"
    },
    {
      "text": "Reconciliation is the process of comparing different sets of financial records to ensure they match.",
      "location": "raw line 25, definitions"
    },
    {
      "text": "You have key stakeholders at both the platform level and at the platform-user level.",
      "location": "raw line 31, stakeholders"
    },
    {
      "text": "Your finance team should be involved early on for effective requirements gathering and education.",
      "location": "raw line 74, requirements"
    },
    {
      "text": "[Read about reporting processes you should prioritize for your users to help them understand their profits and costs.](/platforms/reconciliation-use-cases/first-year-focus/platform-user-level-reporting)",
      "location": "raw line 88, user-level next step"
    }
  ],
  "suggestions": {
    "company": [],
    "concepts": [
      {
        "update_id": "c18-first-year-focus-reporting-route",
        "target_path": "wiki/concepts/adyen-reporting.md",
        "update_kind": "reciprocal_source_link",
        "anchor": "## Sources",
        "proposed_markdown": "- [[source-adyen-docs-platforms-reconciliation-use-cases-first-year-focus]] \u2014 2026-09-15 Platforms first-year planning guide separating platform and SMB-user reporting needs, early finance/product/engineering alignment and child use-case routes; no report grain or completed-reconciliation proof.",
        "quote_indexes": [
          0,
          1,
          2,
          3,
          4
        ],
        "warnings": []
      }
    ],
    "index": [],
    "log": []
  },
  "raw_path": "raw/adyen/docs/platforms/reconciliation-use-cases/first-year-focus/2026-09-15.md",
  "raw_sha256": "0636143828d596711494adc364db080a1c0af48e0fe94b25f27aa0f513987d65",
  "status": "candidate_ready"
}
