{
  "job_id": "docs-payment-methods-pay-by-bank-us-ios-component",
  "attempt": 1,
  "source_page": "---\ntitle: \"Adyen Pay by Bank (US) iOS Redirect Component guide\"\ntype: source\ndate_ingested: 2026-10-27\noriginal_format: webpage\ncanonical_url: \"https://docs.adyen.com/payment-methods/pay-by-bank-us/ios-component\"\nraw_files:\n  - \"adyen/docs/payment-methods/pay-by-bank-us/ios-component/2026-09-15.md\"\ntags: [adyen, pay-by-bank-us, ios, components, plaid, ach, capture, tokenization]\n---\n\n## Overview\n\nThis 2026-09-15 Adyen guide adds Pay by Bank (US) to an existing iOS Components integration in Sessions or Advanced server-side flow. It covers Component selection (including stored methods), bank redirect/outcome delegation to the base integration, ACH capture risk, recurring-token navigation, testing, and Plaid live registration. It is a provider snapshot, not proof of current merchant or bank eligibility, completed registration, captured funds, or a successful payment. See [[adyen]], [[adyen-online-payments]] and [[adyen-tokenization]].\n\n## Key takeaways\n\n- **Flow/version and country:** both Sessions and Advanced require an existing iOS Components integration at **version 5.70.0 or later** and Pay by Bank (US) added in Customer Area. The API section calls `/sessions` the default for base Components v5.0.0+, but that statement does not lower this method's 5.70.0 minimum. The Sessions `countryCode` table marks the field required yet says only **US** is currently supported and US is the default if omitted; preserve this table/prose tension rather than asserting omission is valid. The `/payments` row for an additional use case marks `countryCode` optional and recommends it for future non-US bank support, while still saying US is the current supported/default value. (raw lines 21\u201357)\n- **Component and redirect:** for a regular method, the Swift samples check for `PayByBankUSPaymentMethod` and present `PayByBankUSComponent`; for a stored method, they check for `StoredPayByBankUSPaymentMethod` and present `StoredPaymentMethodComponent`. Sessions delegates to `session`; the `/payments` example delegates to `self`. The page says the existing Components integration handles redirect and payment outcome, with no Pay by Bank (US)-specific extra handling here. A Component presentation or bank return does not establish authorization or settlement. (raw lines 59\u2013130)\n- **Capture and recurrence:** Adyen strongly recommends immediate capture because Plaid's authorization-time balance/risk checks do **not** hold the shopper's funds. It explicitly says insufficient funds remain possible even with immediate capture because ACH Direct Debit capture is asynchronous. It supports tokenization for recurring transactions, strongly recommends explicit shopper permission and disclosure of schedule/amount, and links to general token creation, reuse and management instructions rather than giving a complete token request here. (raw lines 132\u2013150)\n- **TEST paths:** the test redirect mimics LIVE but not all refusal reasons can be simulated. The page gives amount/username scenarios, including `custom_balances`; in the chargeback simulation, `custom_chargeback_rXX` uses an ACH return reason code. The simulated request can be `Authorised` before capture/settlement and then produce a `CHARGEBACK` webhook. Thus a test `Authorised` result is not a guarantee against later ACH return. (raw lines 152\u2013201)\n- **LIVE gate:** adding the method in the live Customer Area starts Plaid registration with participating banks. The page says registration takes up to one business week **from when Plaid starts**; shoppers cannot connect during that period and live acceptance must wait until completion. A `paymentMethod.created` webhook signals when live acceptance can start. Merely submitting or adding the request is not completed registration. (raw lines 203\u2013207)\n\n## Detail locators\n\n- Sessions/Advanced iOS Components minimum and countryCode table/prose tension: pinned raw lines 21\u201357.\n- Regular/stored Component examples and delegate differences: pinned raw lines 59\u2013122; redirect/outcome scope: lines 124\u2013130.\n- Authorization-time checks versus asynchronous ACH capture risk and recurring consent: pinned raw lines 132\u2013150.\n- Payment/chargeback test scenarios and Authorised-to-CHARGEBACK sequence: pinned raw lines 152\u2013201.\n- Plaid live registration delay and `paymentMethod.created` gate: pinned raw lines 203\u2013207.\n\n## Related\n\n- [[adyen-online-payments]] \u2014 main provider Components/payment context\n- [[adyen-tokenization]] \u2014 provider recurring-token lifecycle\n- [[source-adyen-docs-payment-methods-pay-by-bank-us]] \u2014 method and ACH risk overview\n\n## Raw Sources\n\n- [[raw/adyen/docs/payment-methods/pay-by-bank-us/ios-component/2026-09-15|Pay by Bank (US) iOS Component guide, 2026-09-15]]\n",
  "quotes": [
    {
      "text": "The minimum required version is 5.70.0.",
      "location": "raw line 29, Sessions integration type; repeated raw line 36, Advanced integration type"
    },
    {
      "text": "Currently, only **US** is supported. This is also the default if you do not include this parameter.",
      "location": "raw line 49, Sessions countryCode description; repeated raw line 57, payments countryCode description"
    },
    {
      "text": "Your Components integration handles the redirect, so you do not need to do anything additional for Pay by Bank (US).",
      "location": "raw line 126, Redirect handling"
    },
    {
      "text": "However, even with immediate capture there is still a risk of insufficient funds at the time of capture, because capturing is an asynchronous process on the ACH Direct Debit network.",
      "location": "raw line 138, Capture"
    },
    {
      "text": "We send you a [paymentMethod.created](https://docs.adyen.com/api-explorer/ManagementNotification/latest/post/paymentMethod.created) webhook when you can start accepting live Pay by Bank (US) payments.",
      "location": "raw line 207, Go live"
    }
  ],
  "suggestions": {
    "company": [],
    "concepts": [
      {
        "update_id": "pay-by-bank-us-ios-component-online-payments-route",
        "target_path": "wiki/concepts/adyen-online-payments.md",
        "update_kind": "reciprocal_source_link",
        "anchor": "## Sources",
        "proposed_markdown": "- [[source-adyen-docs-payment-methods-pay-by-bank-us-ios-component]] \u2014 2026-09-15 Pay by Bank (US) iOS Components Sessions/Advanced guide with 5.70.0 minimum, ACH capture risk, stored Component path and Plaid live-registration gate; countryCode table/prose tension in source.\n",
        "quote_indexes": [
          0,
          1,
          2,
          3,
          4
        ],
        "warnings": []
      }
    ],
    "index": [],
    "log": []
  },
  "raw_path": "raw/adyen/docs/payment-methods/pay-by-bank-us/ios-component/2026-09-15.md",
  "raw_sha256": "f8366fb5857f88439f2c1c33b40986057c85152e8a70c1da54d9f87aa164278c",
  "status": "candidate_ready"
}
