{
  "job_id": "docs-point-of-sale-user-manuals-terminal-deprecation-vx690-user-manual-print-shift-and-end-of-day-reports-vx690",
  "attempt": 1,
  "source_page": "---\ntitle: \"Adyen VX690 historical transaction-totals print and reset\"\ntype: source\ndate_ingested: 2026-10-23\noriginal_format: webpage\ncanonical_url: \"https://docs.adyen.com/point-of-sale/user-manuals/terminal-deprecation/vx690-user-manual/print-shift-and-end-of-day-reports-vx690\"\nraw_files:\n  - \"adyen/docs/point-of-sale/user-manuals/terminal-deprecation/vx690-user-manual/print-shift-and-end-of-day-reports-vx690/2026-09-15.md\"\ntags: [adyen, point-of-sale, vx690, totals, reports, legacy]\n---\n\n## Overview\n\nThis [[adyen]] VX690 manual page, last modified in 2019 and captured 2026-09-15, describes printing a terminal summary of **total amounts processed since the last counter reset**. Although the path mentions shift and end-of-day reports and the steps call the printout \u201cday totals,\u201d the page defines the counting window by the last reset, not by a calendar day or shift. See [[adyen-payment-terminals]]; this local terminal summary is distinct from [[adyen-reporting]] financial reports.\n\nThe separate [[source-adyen-docs-point-of-sale-user-manuals-terminal-deprecation]] schedule lists VX690 with **29 March 2024** under \u201cNo more transactions\u201d (that page's raw lines 32\u201335). Printing a historical terminal total is not proof of current device support, particular payment authorization, reconciliation, settlement, payout or bank receipt.\n\n## Key takeaways\n\n- **PIN-gated print path:** The guide uses an illustrated VX690 key with **9**, then the Admin-menu PIN, **4. Totals** and **2. Print totals**. The raw page's Print totals line has malformed markup; use the pinned line and button image for exact interface identification rather than guessing from the image filename. Unknown Admin PINs route to POS Troubleshooting/Support. See pinned raw lines 25\u201333.\n- **Reset changes the next summary's window:** The page first advises resetting counters after printing **if** periodic summary reports are wanted. Its numbered sequence then expressly says to press **Yes** to reset the counter after printing. Do not collapse the conditional advice into an always-required precondition or omit the explicit reset action; it changes the since-last-reset basis for later local totals. The page does not say that resetting changes prior payments or settlement records. See pinned raw lines 17\u201323 and 31.\n- **Report scope:** The page describes an overview of total amounts processed since the last reset; it does not supply transaction-level, settlement or payout fields. See pinned raw lines 15\u201319.\n\n## Detail locators\n\n- Summary definition and counting window: pinned raw lines 15\u201319.\n- Conditional periodic-report advice: pinned raw line 23.\n- Illustrated key, Admin PIN, Totals/Print totals menu labels, reset prompt and PIN-help route: pinned raw lines 25\u201333.\n\n## Related\n\n- [[adyen-payment-terminals]] \u2014 VX690 physical-device context.\n- [[adyen-reporting]] \u2014 separate provider reporting and reconciliation scope.\n- [[source-adyen-docs-point-of-sale-user-manuals-terminal-deprecation]] \u2014 later VX690 transaction cutoff.\n\n## Raw Sources\n\n- [[raw/adyen/docs/point-of-sale/user-manuals/terminal-deprecation/vx690-user-manual/print-shift-and-end-of-day-reports-vx690/2026-09-15|VX690 transaction-totals print guide, captured 2026-09-15]]\n",
  "quotes": [
    {
      "text": "Print a summary with an overview of the total amounts processed\u00a0since the last reset.",
      "location": "pinned raw line 17"
    },
    {
      "text": "If you want to print a summary report periodically, reset the counters after printing the report.",
      "location": "pinned raw line 23"
    },
    {
      "text": "2. Enter the PIN code for the Admin menu. If you do not know this code, see our [POS Troubleshooting section](/point-of-sale/pos-troubleshooting/terminal-turns-on/admin-pin/).",
      "location": "pinned raw line 28"
    },
    {
      "text": "3. Press\u00a0**4. Totals**.",
      "location": "pinned raw line 29"
    },
    {
      "text": "5. After printing the day totals, press\u00a0**Yes** to reset the counter.",
      "location": "pinned raw line 31"
    }
  ],
  "suggestions": {
    "company": [],
    "concepts": [
      {
        "update_id": "c30-vx690-terminal-totals-source-route",
        "target_path": "wiki/concepts/adyen-payment-terminals.md",
        "update_kind": "reciprocal_source_link",
        "anchor": "## Sources",
        "proposed_markdown": "- [[source-adyen-docs-point-of-sale-user-manuals-terminal-deprecation-vx690-user-manual-print-shift-and-end-of-day-reports-vx690]] \u2014 2019-modified, 2026-09-15-captured historical VX690 since-last-reset totals print guide with an explicit post-print counter reset step; not settlement or payout proof.\n",
        "quote_indexes": [
          0,
          1,
          2,
          3,
          4
        ],
        "warnings": [
          "The guide's prose makes counter resetting conditional on wanting periodic reports, while step 5 instructs Yes to reset after printing. Keep both; resetting changes the window for subsequent local summaries. 'Day totals' does not change its stated since-last-reset scope."
        ]
      }
    ],
    "index": [],
    "log": []
  },
  "raw_path": "raw/adyen/docs/point-of-sale/user-manuals/terminal-deprecation/vx690-user-manual/print-shift-and-end-of-day-reports-vx690/2026-09-15.md",
  "raw_sha256": "3a2924efbb6167e00946fa1b321ef28b8814aa4f1fb1d01ad04e1afc410eba5e",
  "status": "candidate_ready"
}
