{
  "job_id": "docs-online-payments-classic-integrations-classic-api-integration-3d-secure-authentication",
  "attempt": 1,
  "source_page": "---\ntitle: \"Adyen Classic API 3D Secure authentication overview\"\ntype: source\ndate_ingested: 2026-10-15\noriginal_format: webpage\ncanonical_url: \"https://docs.adyen.com/online-payments/classic-integrations/classic-api-integration/3d-secure-authentication\"\nraw_files:\n  - \"adyen/docs/online-payments/classic-integrations/classic-api-integration/3d-secure-authentication/2026-09-15.md\"\ntags: [adyen, classic-api, 3d-secure, 3ds2, authentication, legacy]\n---\n\n## Overview\n\nThis Adyen Classic integration page surveys historical 3D Secure authentication routes for card-not-present payments. The page labels its endpoint **inactive** and no longer supported for new integrations: it directs new online-payment builds to Checkout API and existing Classic integrations to contact Adyen and migrate. Its metadata says last modified 2019-08-28, although the raw snapshot was captured 2026-09-15. See [[adyen]], [[adyen-3d-secure]] and [[adyen-online-payments]].\n\n## Key takeaways\n\n- The historical Classic choices are redirect authentication for 3D Secure 1 or 2, and native 3DS2 through web helpers or iOS/Android SDKs with a 3DS1 redirect path. The page describes redirect as issuer-version-dependent and says a native 3DS2 route may still be sent to the 3DS1 flow based on issuer performance. These are navigation and migration context for existing integrations, not a present-day implementation recommendation or evidence of current 3DS1 availability.\n- For existing 3DS1 integrations, the page says a returned redirect URL can carry a 3DS2 transaction to an Adyen-hosted authentication page. Its integration table also lists period-specific legacy SDK/plugin versions and \u201cdo nothing\u201d redirect support. Those historical claims do not establish current support, compatibility or merchant eligibility.\n- The source's 2020/2021 prediction that 3DS2 would replace 3DS1, and its interim advice to handle both, are dated statements. Do not infer the present status of 3DS1 from them.\n- 3D Secure is shopper authentication, separate from a payment authorization or capture. The page offers no transaction result or proof of PSD2 compliance or liability shift for a particular payment; its broad liability wording must be read with scheme-, region- and outcome-specific rules in [[adyen-3d-secure]].\n\n## Detail locators\n\n- Lines 19\u201324: inactive endpoint warning and new/existing integration routes.\n- `## Understanding 3D Secure versions` (lines 33\u201340): dated 3DS1/3DS2 description and 2020/2021 forecast.\n- `## Your 3D Secure implementation options` (lines 42\u201358): historical redirect and native-plus-redirect option links.\n- `## Implementing 3D Secure 2 with your existing Adyen integration` (lines 60\u201383): redirect guidance and legacy integration/version table; treat \u201cdo nothing\u201d rows as dated, not current instructions.\n- Lines 85\u201393: navigation to PSD2 SCA and Classic API native 3DS2 guides.\n\n## Related\n\n- [[adyen-3d-secure]] \u2014 provider 3DS concept and reciprocal Classic source route.\n- [[adyen-online-payments]] \u2014 Checkout API online-payments context.\n- [[source-adyen-docs-online-payments-classic-integrations]] \u2014 Classic Ecommerce navigation and inactive scope.\n\n## Raw Sources\n\n- [[raw/adyen/docs/online-payments/classic-integrations/classic-api-integration/3d-secure-authentication/2026-09-15|Classic 3D Secure authentication overview, captured 2026-09-15]]\n",
  "quotes": [
    {
      "text": "This endpoint is [inactive](/online-payments/upgrade-your-integration#checkout-api-lifecycle) and is no longer supported for new integrations.",
      "location": "raw/adyen/docs/online-payments/classic-integrations/classic-api-integration/3d-secure-authentication/2026-09-15.md:19"
    },
    {
      "text": "* If you are building a new integration, [build an online payments](/online-payments/build-your-integration/) integration with Checkout API instead.",
      "location": "raw/adyen/docs/online-payments/classic-integrations/classic-api-integration/3d-secure-authentication/2026-09-15.md:21"
    },
    {
      "text": "* If you have an existing integration using this endpoint, reach out to your Adyen contact and [migrate to Checkout API](/online-payments/upgrade-your-integration/migrate-to-checkout-api).",
      "location": "raw/adyen/docs/online-payments/classic-integrations/classic-api-integration/3d-secure-authentication/2026-09-15.md:22"
    },
    {
      "text": "Until card schemes fully decommission 3D Secure 1 by 2020/2021, we expect that some issuing banks will continue to support and require 3D Secure 1. This means that you should be able to handle both 3D Secure 1 and 3D Secure 2 authentication transactions on your checkout page.",
      "location": "raw/adyen/docs/online-payments/classic-integrations/classic-api-integration/3d-secure-authentication/2026-09-15.md:40"
    },
    {
      "text": "* **Native 3DS2 + Redirect 3DS1**: Use our 3D Secure 2 [helper functions for Web](/online-payments/classic-integrations/classic-api-integration/3d-secure-authentication/native-3ds2/browser-based-integration) and SDKs for [iOS](/online-payments/classic-integrations/classic-api-integration/3d-secure-authentication/native-3ds2/ios-sdk-integration) and [Android](/online-payments/classic-integrations/classic-api-integration/3d-secure-authentication/native-3ds2/android-sdk-integration) to perform 3D Secure 2 authentication within your site or mobile app. Based on issuer performance, our Authentication Engine might also route the payment to the 3D Secure 1 flow. For [3D Secure 1](/online-payments/classic-integrations/classic-api-integration/3d-secure-authentication/3d-secure-1) authentication, you should handle the redirect on your client-side implementation.",
      "location": "raw/adyen/docs/online-payments/classic-integrations/classic-api-integration/3d-secure-authentication/2026-09-15.md:48"
    }
  ],
  "suggestions": {
    "company": [],
    "concepts": [
      {
        "update_id": "c9-classic-3ds-overview-route",
        "target_path": "wiki/concepts/adyen-3d-secure.md",
        "update_kind": "reciprocal_source_link",
        "anchor": "## Related",
        "proposed_markdown": "- [[source-adyen-docs-online-payments-classic-integrations-classic-api-integration-3d-secure-authentication]] \u2014 2019-modified Classic API 3DS overview (captured 2026-09-15): inactive endpoint, Checkout API migration route and historical redirect/native 3DS2 plus 3DS1 navigation; no current 3DS1 support inference.\n",
        "quote_indexes": [
          0,
          1,
          2,
          3,
          4
        ],
        "warnings": []
      }
    ],
    "index": [],
    "log": []
  },
  "raw_path": "raw/adyen/docs/online-payments/classic-integrations/classic-api-integration/3d-secure-authentication/2026-09-15.md",
  "raw_sha256": "9c6969615eb7736b32c88de61b836c0519241f4d10bd6b91932fe943f94bb0ba",
  "status": "candidate_ready"
}
