{
  "job_id": "docs-point-of-sale-user-manuals-terminal-deprecation-e355-user-manual-make-a-payment-on-the-e355-over-bluetooth",
  "attempt": 1,
  "source_page": "---\ntitle: \"e355 Bluetooth payment path (historical guide)\"\ntype: source\ndate_ingested: 2026-10-22\noriginal_format: webpage\ncanonical_url: \"https://docs.adyen.com/point-of-sale/user-manuals/terminal-deprecation/e355-user-manual/make-a-payment-on-the-e355-over-bluetooth\"\nraw_files:\n  - \"adyen/docs/point-of-sale/user-manuals/terminal-deprecation/e355-user-manual/make-a-payment-on-the-e355-over-bluetooth/2026-09-15.md\"\ntags: [adyen, point-of-sale, payment-terminals, e355, bluetooth, historical]\n---\n\n## Overview\n\nThis [[adyen]] e355 Pin Entry Device guide was last modified in **2019** and captured 2026-09-15 under terminal-deprecation manuals. It is a short navigation and compatibility page for a Bluetooth-connected POS App path: clean up pairing, pair the mobile device, reboard if needed, and start a transaction. It is not a payment result or present-day support claim; see [[adyen-payment-terminals]] and the later [[source-adyen-docs-point-of-sale-user-manuals-terminal-deprecation|eVo/Verix deprecation schedule]], which lists **29 March 2024** as the e355 \u201cNo more transactions\u201d date.\n\n## Key takeaways\n\n- The page recommends a clean Bluetooth configuration and removal of unnecessary paired devices, with a link to a separate unpairing procedure (raw lines 19\u201321). This is advice in this guide, not a blanket requirement to unpair every device.\n- Its listed flow links to e355/mobile-device pairing, removing configuration and reboarding, and starting a transaction (raw lines 23\u201329). The document labels this \u201c3 steps\u201d yet the first linked item is named \u201cStep 2\u201d and the last \u201cStep 3\u201d; the separate clean-configuration link appears above the list. Follow the child guides for procedures rather than inferring missing steps from these labels.\n- The POS App and e355 should use the same serial communication protocol version. The page calls version **2** current at its 2019 modification time. With a mismatch, Bluetooth pairing can succeed while boarding and transaction start fail, leaving the app in initialization (raw line 31). Pairing alone therefore does not establish a usable payment connection.\n- The page gives no card-present interaction, authorization response, capture, settlement or observed transaction outcome. Its \u201cStart a transaction\u201d item is a link to another guide (raw line 29), and neither it nor historical successful pairing overrides later device deprecation.\n\n## Detail locators\n\n- Clean Bluetooth configuration advice and linked unpairing guide: raw lines 19\u201321.\n- Linked pair, reboard and transaction-start stages: raw lines 23\u201329.\n- Same-protocol requirement, historical version number and mismatch failure: raw line 31.\n\n## Related\n\n- [[adyen]]\n- [[adyen-payment-terminals]]\n- [[source-adyen-docs-point-of-sale-user-manuals-terminal-deprecation]]\n- [[source-adyen-docs-point-of-sale-user-manuals-terminal-deprecation-e355-user-manual-make-a-payment-on-the-e355-over-bluetooth-step-2-pair-the-e355-with-a-mobile-device]]\n\n## Raw Sources\n\n- [[raw/adyen/docs/point-of-sale/user-manuals/terminal-deprecation/e355-user-manual/make-a-payment-on-the-e355-over-bluetooth/2026-09-15|Full pinned e355 Bluetooth guide]]",
  "quotes": [
    {
      "text": "Make a payment on the e355 Pin Entry Device (PED) through the Bluetooth connection.",
      "location": "raw/adyen/docs/point-of-sale/user-manuals/terminal-deprecation/e355-user-manual/make-a-payment-on-the-e355-over-bluetooth/2026-09-15.md:17"
    },
    {
      "text": "It is always a good idea to start with a clean Bluetooth configuration.",
      "location": "raw/adyen/docs/point-of-sale/user-manuals/terminal-deprecation/e355-user-manual/make-a-payment-on-the-e355-over-bluetooth/2026-09-15.md:21"
    },
    {
      "text": "[Remove configuration and reboard]",
      "location": "raw/adyen/docs/point-of-sale/user-manuals/terminal-deprecation/e355-user-manual/make-a-payment-on-the-e355-over-bluetooth/2026-09-15.md:28"
    },
    {
      "text": "At the moment this is version 2.",
      "location": "raw/adyen/docs/point-of-sale/user-manuals/terminal-deprecation/e355-user-manual/make-a-payment-on-the-e355-over-bluetooth/2026-09-15.md:31"
    },
    {
      "text": "Pairing will succeed but boarding and starting a transaction will not and the app will be stuck in the initialization phase.",
      "location": "raw/adyen/docs/point-of-sale/user-manuals/terminal-deprecation/e355-user-manual/make-a-payment-on-the-e355-over-bluetooth/2026-09-15.md:31"
    }
  ],
  "suggestions": {
    "company": [],
    "concepts": [
      {
        "update_id": "c29-e355-bluetooth-payment-path-source",
        "target_path": "wiki/concepts/adyen-payment-terminals.md",
        "update_kind": "reciprocal_source_link",
        "anchor": "## Sources",
        "proposed_markdown": "- [[source-adyen-docs-point-of-sale-user-manuals-terminal-deprecation-e355-user-manual-make-a-payment-on-the-e355-over-bluetooth]] \u2014 2019-modified historical e355 Bluetooth pair/reboard/transaction-start navigation and POS App protocol-v2 mismatch warning; successful pairing is not successful boarding or payment, and later deprecation limits device use.",
        "quote_indexes": [
          0,
          1,
          2,
          3,
          4
        ],
        "warnings": [
          "Historical guide's transaction-start navigation must not override the later e355 29 March 2024 no-transactions date in the terminal-deprecation source."
        ]
      }
    ],
    "index": [],
    "log": []
  },
  "raw_path": "raw/adyen/docs/point-of-sale/user-manuals/terminal-deprecation/e355-user-manual/make-a-payment-on-the-e355-over-bluetooth/2026-09-15.md",
  "raw_sha256": "6710b20ceb8aa4439e8205542c1ab81641cc631bff39a8753b09673536edec68",
  "status": "candidate_ready"
}
